{
  "$schema": "../../../../docs/localization/schema.json",
  "language": "en",
  "name": "English",
  "fallback": "en",
  "complete": true,
  "strings": {
    "menu.enable": "Enable",
    "menu.demo": "Play Demo",
    "menu.gestureTips": "Show Gesture Tips",
    "menu.skin": "Record Skin",
    "menu.player": "Player",
    "menu.retryPlayer": "Reconnect to %1$@",
    "menu.openPlayer": "Open %1$@",
    "menu.automationSettings": "Automation Settings…",
    "menu.checkUpdates": "Check for Updates…",
    "menu.checkingUpdates": "Checking for Updates…",
    "menu.updateAvailable": "Umak %1$@ Available",
    "menu.clearDesktopRecords": "Clear Desktop Records (%1$d)",
    "menu.quit": "Quit Umak",
    "skin.classic": "Classic Black",
    "skin.rust": "Rust",
    "skin.teal": "Deep Teal",
    "skin.smoke": "Smoke",
    "skin.mono": "Mono",
    "player.auto": "Auto",
    "player.music": "Music",
    "player.spotify": "Spotify",
    "status.noDisplay": "No available display",
    "status.overlayInactive": "Overlay inactive",
    "status.disabled": "Disabled",
    "status.playerNotRunning": "%1$@ isn't running",
    "status.noTrack": "Nothing to play",
    "status.permissionRequired": "%1$@ needs Automation permission",
    "header.noTrack": "Nothing playing",
    "overlay.pullToLock": "Pull further to lock",
    "overlay.dropToRemove": "Drop to remove",
    "hint.click.title": "Click",
    "hint.click.detail": "Play or pause",
    "hint.swipe.title": "Two-finger swipe",
    "hint.swipe.detail": "Previous · next track",
    "hint.pull.title": "Pull down",
    "hint.pull.detail": "Open the record",
    "alert.permissionTitle": "Umak can't control %1$@",
    "alert.permissionBody": "Allow Umak to control %1$@ in System Settings → Privacy & Security → Automation.",
    "alert.openSettings": "Open Settings",
    "alert.later": "Later",
    "alert.ok": "OK",
    "alert.clearDesktopRecordsTitle": "Clear desktop records?",
    "alert.clearDesktopRecordsBody": "%1$d records on your desktop will be removed. The record in the notch and playback are not affected.",
    "alert.clear": "Clear",
    "alert.updateTitle": "Update Available",
    "alert.updateBody": "Umak %1$@ is available. You're using %2$@.",
    "alert.openRelease": "Open Release Page",
    "alert.upToDateTitle": "You're Up to Date",
    "alert.upToDateBody": "Umak %1$@ is the latest version.",
    "alert.updateFailedTitle": "Couldn't Check for Updates",
    "alert.updateFailedBody": "Check your internet connection and try again.",
    "a11y.app": "Umak",
    "a11y.headerTitle": "Umak, %1$@",
    "a11y.headerTitleArtist": "Umak, %1$@, %2$@",
    "a11y.headerStatus": "Umak, %1$@",
    "info.appleEventsUsageDescription": "Umak controls Music and Spotify to seek through the current track by turning the record in the notch."
  }
}
