{
  "$schema": "../../../../docs/localization/schema.json",
  "language": "ko",
  "name": "한국어",
  "fallback": "en",
  "complete": true,
  "strings": {
    "menu.enable": "활성화",
    "menu.demo": "데모 재생",
    "menu.gestureTips": "제스처 안내 보기",
    "menu.skin": "레코드 스킨",
    "menu.player": "플레이어",
    "menu.retryPlayer": "%1$@ 연결 다시 시도",
    "menu.openPlayer": "%1$@ 열기",
    "menu.automationSettings": "자동화 권한 설정…",
    "menu.checkUpdates": "업데이트 확인…",
    "menu.checkingUpdates": "업데이트 확인 중…",
    "menu.updateAvailable": "Umak %1$@ 사용 가능",
    "menu.clearDesktopRecords": "바탕화면 레코드 정리 (%1$d)",
    "menu.quit": "Umak 종료",
    "skin.classic": "클래식 블랙",
    "skin.rust": "러스트",
    "skin.teal": "딥 틸",
    "skin.smoke": "스모크",
    "skin.mono": "모노",
    "player.auto": "자동",
    "player.music": "Music",
    "player.spotify": "Spotify",
    "status.noDisplay": "사용 가능한 디스플레이를 찾을 수 없습니다",
    "status.overlayInactive": "오버레이 비활성",
    "status.disabled": "비활성화됨",
    "status.playerNotRunning": "%1$@이(가) 실행 중이 아닙니다",
    "status.noTrack": "재생할 트랙이 없습니다",
    "status.permissionRequired": "%1$@ 자동화 권한이 필요합니다",
    "header.noTrack": "재생 중인 곡 없음",
    "overlay.pullToLock": "더 당겨서 고정",
    "overlay.dropToRemove": "놓아서 정리",
    "hint.click.title": "클릭",
    "hint.click.detail": "재생·일시정지",
    "hint.swipe.title": "두 손가락 스와이프",
    "hint.swipe.detail": "이전·다음 곡",
    "hint.pull.title": "아래로 당기기",
    "hint.pull.detail": "레코드 꺼내기",
    "hint.up.title": "위로 스와이프",
    "hint.up.detail": "음악 앱 부르기",
    "alert.permissionTitle": "Umak이 %1$@을(를) 제어할 수 없습니다",
    "alert.permissionBody": "시스템 설정 → 개인정보 보호 및 보안 → 자동화에서 Umak이 %1$@을(를) 제어하도록 허용해 주세요.",
    "alert.openSettings": "설정 열기",
    "alert.later": "나중에",
    "alert.ok": "확인",
    "alert.clearDesktopRecordsTitle": "바탕화면 레코드를 정리할까요?",
    "alert.clearDesktopRecordsBody": "바탕화면에 놓인 레코드 %1$d장이 모두 사라집니다. 노치의 레코드와 재생에는 영향이 없습니다.",
    "alert.clear": "정리",
    "alert.updateTitle": "업데이트가 있습니다",
    "alert.updateBody": "Umak %1$@ 버전이 나왔습니다. 현재 %2$@ 버전을 사용 중입니다.",
    "alert.openRelease": "릴리스 페이지 열기",
    "alert.upToDateTitle": "최신 버전입니다",
    "alert.upToDateBody": "현재 최신 버전(%1$@)을 사용 중입니다.",
    "alert.updateFailedTitle": "업데이트를 확인할 수 없습니다",
    "alert.updateFailedBody": "인터넷 연결을 확인한 뒤 다시 시도해 주세요.",
    "a11y.app": "Umak",
    "a11y.headerTitle": "Umak, %1$@",
    "a11y.headerTitleArtist": "Umak, %1$@, %2$@",
    "a11y.headerStatus": "Umak, %1$@",
    "info.appleEventsUsageDescription": "Umak은 노치에서 LP판을 돌려 Music 또는 Spotify의 재생 위치를 탐색하기 위해 해당 앱을 제어합니다."
  }
}
